Started by user Sandhya
[Pipeline] Start of Pipeline
[Pipeline] node
Running on Jenkins in /Users/sandhyas/.jenkins/workspace/Calculator
[Pipeline] {
[Pipeline] tool
[Pipeline] withEnv
[Pipeline] {
[Pipeline] stage
[Pipeline] { (Declarative: Tool Install)
[Pipeline] tool
[Pipeline] envVarsForTool
[Pipeline] tool
[Pipeline] envVarsForTool
[Pipeline] }
[Pipeline] // stage
[Pipeline] withEnv
[Pipeline] {
[Pipeline] stage
[Pipeline] { (Git-Checkout)
[Pipeline] tool
[Pipeline] envVarsForTool
[Pipeline] tool
[Pipeline] envVarsForTool
[Pipeline] withEnv
[Pipeline] {
[Pipeline] git
The recommended git tool is: NONE
using credential git-cred
 > git rev-parse --resolve-git-dir /Users/sandhyas/.jenkins/workspace/Calculator/.git # timeout=10
Fetching changes from the remote Git repository
 > git config remote.origin.url https://github.com/sandhyasankar29/SIPCalculator.git # timeout=10
Fetching upstream changes from https://github.com/sandhyasankar29/SIPCalculator.git
 > git --version # timeout=10
 > git --version # 'git version 2.39.3 (Apple Git-146)'
using GIT_ASKPASS to set credentials git-credential
 > git fetch --tags --force --progress -- https://github.com/sandhyasankar29/SIPCalculator.git +refs/heads/*:refs/remotes/origin/* # timeout=10
 > git rev-parse refs/remotes/origin/main^{commit} # timeout=10
Checking out Revision 6ef71c425722919c0e5db3f9708d073fb5217b0e (refs/remotes/origin/main)
 > git config core.sparsecheckout # timeout=10
 > git checkout -f 6ef71c425722919c0e5db3f9708d073fb5217b0e # timeout=10
 > git branch -a -v --no-abbrev # timeout=10
 > git branch -D main # timeout=10
 > git checkout -b main 6ef71c425722919c0e5db3f9708d073fb5217b0e # timeout=10
Commit message: "Fail Test"
 > git rev-list --no-walk 4cd25bb2314e814597f280eea912f0d7b2ec4b93 # timeout=10
[Pipeline] }
[Pipeline] // withEnv
[Pipeline] }
[Pipeline] // stage
[Pipeline] stage
[Pipeline] { (Compile)
[Pipeline] tool
[Pipeline] envVarsForTool
[Pipeline] tool
[Pipeline] envVarsForTool
[Pipeline] withEnv
[Pipeline] {
[Pipeline] sh
+ mvn clean compile
[INFO] Scanning for projects...
[WARNING] 
[WARNING] Some problems were encountered while building the effective model for com.ra.busBooking:SIPCalculator:jar:0.0.1-SNAPSHOT
[WARNING] 'dependencies.dependency.(groupId:artifactId:type:classifier)' must be unique: org.springframework.boot:spring-boot-starter-thymeleaf:jar -> duplicate declaration of version (?) @ line 29, column 15
[WARNING] 'dependencies.dependency.(groupId:artifactId:type:classifier)' must be unique: org.springframework.boot:spring-boot-starter-test:jar -> duplicate declaration of version (?) @ line 38, column 15
[WARNING] 
[WARNING] It is highly recommended to fix these problems because they threaten the stability of your build.
[WARNING] 
[WARNING] For this reason, future Maven versions might no longer support building such malformed projects.
[WARNING] 
[INFO] 
[INFO] ------------------< com.ra.busBooking:SIPCalculator >-------------------
[INFO] Building SIPCalculator 0.0.1-SNAPSHOT
[INFO]   from pom.xml
[INFO] --------------------------------[ jar ]---------------------------------
[WARNING] 1 problem was encountered while building the effective model for org.javassist:javassist:jar:3.20.0-GA during dependency collection step for project (use -X to see details)
[INFO] 
[INFO] --- clean:3.2.0:clean (default-clean) @ SIPCalculator ---
[INFO] Deleting /Users/sandhyas/.jenkins/workspace/Calculator/target
[INFO] 
[INFO] --- resources:3.2.0:resources (default-resources) @ SIPCalculator ---
[INFO] Using 'UTF-8' encoding to copy filtered resources.
[INFO] Using 'UTF-8' encoding to copy filtered properties files.
[INFO] Copying 1 resource
[INFO] Copying 1 resource
[INFO] 
[INFO] --- compiler:3.10.1:compile (default-compile) @ SIPCalculator ---
[INFO] Changes detected - recompiling the module!
[INFO] Compiling 3 source files to /Users/sandhyas/.jenkins/workspace/Calculator/target/classes
[INFO] ------------------------------------------------------------------------
[INFO] BUILD SUCCESS
[INFO] ------------------------------------------------------------------------
[INFO] Total time:  0.971 s
[INFO] Finished at: 2024-08-25T23:08:19+05:30
[INFO] ------------------------------------------------------------------------
[Pipeline] }
[Pipeline] // withEnv
[Pipeline] }
[Pipeline] // stage
[Pipeline] stage
[Pipeline] { (Build)
[Pipeline] tool
[Pipeline] envVarsForTool
[Pipeline] tool
[Pipeline] envVarsForTool
[Pipeline] withEnv
[Pipeline] {
[Pipeline] sh
+ mvn clean package -DskipTests
[INFO] Scanning for projects...
[WARNING] 
[WARNING] Some problems were encountered while building the effective model for com.ra.busBooking:SIPCalculator:jar:0.0.1-SNAPSHOT
[WARNING] 'dependencies.dependency.(groupId:artifactId:type:classifier)' must be unique: org.springframework.boot:spring-boot-starter-thymeleaf:jar -> duplicate declaration of version (?) @ line 29, column 15
[WARNING] 'dependencies.dependency.(groupId:artifactId:type:classifier)' must be unique: org.springframework.boot:spring-boot-starter-test:jar -> duplicate declaration of version (?) @ line 38, column 15
[WARNING] 
[WARNING] It is highly recommended to fix these problems because they threaten the stability of your build.
[WARNING] 
[WARNING] For this reason, future Maven versions might no longer support building such malformed projects.
[WARNING] 
[INFO] 
[INFO] ------------------< com.ra.busBooking:SIPCalculator >-------------------
[INFO] Building SIPCalculator 0.0.1-SNAPSHOT
[INFO]   from pom.xml
[INFO] --------------------------------[ jar ]---------------------------------
[WARNING] 1 problem was encountered while building the effective model for org.javassist:javassist:jar:3.20.0-GA during dependency collection step for project (use -X to see details)
[INFO] 
[INFO] --- clean:3.2.0:clean (default-clean) @ SIPCalculator ---
[INFO] Deleting /Users/sandhyas/.jenkins/workspace/Calculator/target
[INFO] 
[INFO] --- resources:3.2.0:resources (default-resources) @ SIPCalculator ---
[INFO] Using 'UTF-8' encoding to copy filtered resources.
[INFO] Using 'UTF-8' encoding to copy filtered properties files.
[INFO] Copying 1 resource
[INFO] Copying 1 resource
[INFO] 
[INFO] --- compiler:3.10.1:compile (default-compile) @ SIPCalculator ---
[INFO] Changes detected - recompiling the module!
[INFO] Compiling 3 source files to /Users/sandhyas/.jenkins/workspace/Calculator/target/classes
[INFO] 
[INFO] --- resources:3.2.0:testResources (default-testResources) @ SIPCalculator ---
[INFO] Using 'UTF-8' encoding to copy filtered resources.
[INFO] Using 'UTF-8' encoding to copy filtered properties files.
[INFO] skip non existing resourceDirectory /Users/sandhyas/.jenkins/workspace/Calculator/src/test/resources
[INFO] 
[INFO] --- compiler:3.10.1:testCompile (default-testCompile) @ SIPCalculator ---
[INFO] Changes detected - recompiling the module!
[INFO] Compiling 2 source files to /Users/sandhyas/.jenkins/workspace/Calculator/target/test-classes
[INFO] 
[INFO] --- surefire:2.22.2:test (default-test) @ SIPCalculator ---
[INFO] Tests are skipped.
[INFO] 
[INFO] --- jar:3.2.2:jar (default-jar) @ SIPCalculator ---
[INFO] Building jar: /Users/sandhyas/.jenkins/workspace/Calculator/target/SIPCalculator-0.0.1-SNAPSHOT.jar
[INFO] 
[INFO] --- spring-boot:2.7.3:repackage (repackage) @ SIPCalculator ---
[INFO] Replacing main artifact with repackaged archive
[INFO] ------------------------------------------------------------------------
[INFO] BUILD SUCCESS
[INFO] ------------------------------------------------------------------------
[INFO] Total time:  1.444 s
[INFO] Finished at: 2024-08-25T23:08:22+05:30
[INFO] ------------------------------------------------------------------------
[Pipeline] }
[Pipeline] // withEnv
[Pipeline] }
[Pipeline] // stage
[Pipeline] stage
[Pipeline] { (Test)
[Pipeline] tool
[Pipeline] envVarsForTool
[Pipeline] tool
[Pipeline] envVarsForTool
[Pipeline] withEnv
[Pipeline] {
[Pipeline] sh
+ mvn clean test
[INFO] Scanning for projects...
[WARNING] 
[WARNING] Some problems were encountered while building the effective model for com.ra.busBooking:SIPCalculator:jar:0.0.1-SNAPSHOT
[WARNING] 'dependencies.dependency.(groupId:artifactId:type:classifier)' must be unique: org.springframework.boot:spring-boot-starter-thymeleaf:jar -> duplicate declaration of version (?) @ line 29, column 15
[WARNING] 'dependencies.dependency.(groupId:artifactId:type:classifier)' must be unique: org.springframework.boot:spring-boot-starter-test:jar -> duplicate declaration of version (?) @ line 38, column 15
[WARNING] 
[WARNING] It is highly recommended to fix these problems because they threaten the stability of your build.
[WARNING] 
[WARNING] For this reason, future Maven versions might no longer support building such malformed projects.
[WARNING] 
[INFO] 
[INFO] ------------------< com.ra.busBooking:SIPCalculator >-------------------
[INFO] Building SIPCalculator 0.0.1-SNAPSHOT
[INFO]   from pom.xml
[INFO] --------------------------------[ jar ]---------------------------------
[WARNING] 1 problem was encountered while building the effective model for org.javassist:javassist:jar:3.20.0-GA during dependency collection step for project (use -X to see details)
[INFO] 
[INFO] --- clean:3.2.0:clean (default-clean) @ SIPCalculator ---
[INFO] Deleting /Users/sandhyas/.jenkins/workspace/Calculator/target
[INFO] 
[INFO] --- resources:3.2.0:resources (default-resources) @ SIPCalculator ---
[INFO] Using 'UTF-8' encoding to copy filtered resources.
[INFO] Using 'UTF-8' encoding to copy filtered properties files.
[INFO] Copying 1 resource
[INFO] Copying 1 resource
[INFO] 
[INFO] --- compiler:3.10.1:compile (default-compile) @ SIPCalculator ---
[INFO] Changes detected - recompiling the module!
[INFO] Compiling 3 source files to /Users/sandhyas/.jenkins/workspace/Calculator/target/classes
[INFO] 
[INFO] --- resources:3.2.0:testResources (default-testResources) @ SIPCalculator ---
[INFO] Using 'UTF-8' encoding to copy filtered resources.
[INFO] Using 'UTF-8' encoding to copy filtered properties files.
[INFO] skip non existing resourceDirectory /Users/sandhyas/.jenkins/workspace/Calculator/src/test/resources
[INFO] 
[INFO] --- compiler:3.10.1:testCompile (default-testCompile) @ SIPCalculator ---
[INFO] Changes detected - recompiling the module!
[INFO] Compiling 2 source files to /Users/sandhyas/.jenkins/workspace/Calculator/target/test-classes
[INFO] 
[INFO] --- surefire:2.22.2:test (default-test) @ SIPCalculator ---
[INFO] 
[INFO] -------------------------------------------------------
[INFO]  T E S T S
[INFO] -------------------------------------------------------
[INFO] Running com.sipCalculator.SipCalculatorApplicationTests
23:08:25.370 [main] DEBUG org.springframework.test.context.BootstrapUtils - Instantiating CacheAwareContextLoaderDelegate from class [org.springframework.test.context.cache.DefaultCacheAwareContextLoaderDelegate]
23:08:25.373 [main] DEBUG org.springframework.test.context.BootstrapUtils - Instantiating BootstrapContext using constructor [public org.springframework.test.context.support.DefaultBootstrapContext(java.lang.Class,org.springframework.test.context.CacheAwareContextLoaderDelegate)]
23:08:25.388 [main] DEBUG org.springframework.test.context.BootstrapUtils - Instantiating TestContextBootstrapper for test class [com.sipCalculator.SipCalculatorApplicationTests] from class [org.springframework.boot.test.context.SpringBootTestContextBootstrapper]
23:08:25.392 [main] INFO org.springframework.boot.test.context.SpringBootTestContextBootstrapper - Neither @ContextConfiguration nor @ContextHierarchy found for test class [com.sipCalculator.SipCalculatorApplicationTests], using SpringBootContextLoader
23:08:25.393 [main] DEBUG org.springframework.test.context.support.AbstractContextLoader - Did not detect default resource location for test class [com.sipCalculator.SipCalculatorApplicationTests]: class path resource [com/sipCalculator/SipCalculatorApplicationTests-context.xml] does not exist
23:08:25.393 [main] DEBUG org.springframework.test.context.support.AbstractContextLoader - Did not detect default resource location for test class [com.sipCalculator.SipCalculatorApplicationTests]: class path resource [com/sipCalculator/SipCalculatorApplicationTestsContext.groovy] does not exist
23:08:25.393 [main] INFO org.springframework.test.context.support.AbstractContextLoader - Could not detect default resource locations for test class [com.sipCalculator.SipCalculatorApplicationTests]: no resource found for suffixes {-context.xml, Context.groovy}.
23:08:25.394 [main] INFO org.springframework.test.context.support.AnnotationConfigContextLoaderUtils - Could not detect default configuration classes for test class [com.sipCalculator.SipCalculatorApplicationTests]: SipCalculatorApplicationTests does not declare any static, non-private, non-final, nested classes annotated with @Configuration.
23:08:25.427 [main] DEBUG org.springframework.test.context.support.ActiveProfilesUtils - Could not find an 'annotation declaring class' for annotation type [org.springframework.test.context.ActiveProfiles] and class [com.sipCalculator.SipCalculatorApplicationTests]
23:08:25.448 [main] DEBUG org.springframework.context.annotation.ClassPathScanningCandidateComponentProvider - Identified candidate component class: file [/Users/sandhyas/.jenkins/workspace/Calculator/target/classes/com/sipCalculator/SipCalculatorApplication.class]
23:08:25.448 [main] INFO org.springframework.boot.test.context.SpringBootTestContextBootstrapper - Found @SpringBootConfiguration com.sipCalculator.SipCalculatorApplication for test class com.sipCalculator.SipCalculatorApplicationTests
23:08:25.478 [main] DEBUG org.springframework.boot.test.context.SpringBootTestContextBootstrapper - @TestExecutionListeners is not present for class [com.sipCalculator.SipCalculatorApplicationTests]: using defaults.
23:08:25.478 [main] INFO org.springframework.boot.test.context.SpringBootTestContextBootstrapper - Loaded default TestExecutionListener class names from location [META-INF/spring.factories]: [org.springframework.boot.test.mock.mockito.MockitoTestExecutionListener, org.springframework.boot.test.mock.mockito.ResetMocksTestExecutionListener, org.springframework.boot.test.autoconfigure.restdocs.RestDocsTestExecutionListener, org.springframework.boot.test.autoconfigure.web.client.MockRestServiceServerResetTestExecutionListener, org.springframework.boot.test.autoconfigure.web.servlet.MockMvcPrintOnlyOnFailureTestExecutionListener, org.springframework.boot.test.autoconfigure.web.servlet.WebDriverTestExecutionListener, org.springframework.boot.test.autoconfigure.webservices.client.MockWebServiceServerTestExecutionListener, org.springframework.test.context.web.ServletTestExecutionListener, org.springframework.test.context.support.DirtiesContextBeforeModesTestExecutionListener, org.springframework.test.context.event.ApplicationEventsTestExecutionListener, org.springframework.test.context.support.DependencyInjectionTestExecutionListener, org.springframework.test.context.support.DirtiesContextTestExecutionListener, org.springframework.test.context.transaction.TransactionalTestExecutionListener, org.springframework.test.context.jdbc.SqlScriptsTestExecutionListener, org.springframework.test.context.event.EventPublishingTestExecutionListener]
23:08:25.483 [main] DEBUG org.springframework.boot.test.context.SpringBootTestContextBootstrapper - Skipping candidate TestExecutionListener [org.springframework.test.context.transaction.TransactionalTestExecutionListener] due to a missing dependency. Specify custom listener classes or make the default listener classes and their required dependencies available. Offending class: [org/springframework/transaction/interceptor/TransactionAttributeSource]
23:08:25.483 [main] DEBUG org.springframework.boot.test.context.SpringBootTestContextBootstrapper - Skipping candidate TestExecutionListener [org.springframework.test.context.jdbc.SqlScriptsTestExecutionListener] due to a missing dependency. Specify custom listener classes or make the default listener classes and their required dependencies available. Offending class: [org/springframework/transaction/interceptor/TransactionAttribute]
23:08:25.483 [main] INFO org.springframework.boot.test.context.SpringBootTestContextBootstrapper - Using TestExecutionListeners: [org.springframework.test.context.web.ServletTestExecutionListener@7216fb24, org.springframework.test.context.support.DirtiesContextBeforeModesTestExecutionListener@2072acb2, org.springframework.test.context.event.ApplicationEventsTestExecutionListener@50ecde95, org.springframework.boot.test.mock.mockito.MockitoTestExecutionListener@35a9782c, org.springframework.boot.test.autoconfigure.SpringBootDependencyInjectionTestExecutionListener@70a36a66, org.springframework.test.context.support.DirtiesContextTestExecutionListener@45815ffc, org.springframework.test.context.event.EventPublishingTestExecutionListener@732f29af, org.springframework.boot.test.mock.mockito.ResetMocksTestExecutionListener@d3957fe, org.springframework.boot.test.autoconfigure.restdocs.RestDocsTestExecutionListener@6622fc65, org.springframework.boot.test.autoconfigure.web.client.MockRestServiceServerResetTestExecutionListener@299321e2, org.springframework.boot.test.autoconfigure.web.servlet.MockMvcPrintOnlyOnFailureTestExecutionListener@23fb172e, org.springframework.boot.test.autoconfigure.web.servlet.WebDriverTestExecutionListener@64ba3208, org.springframework.boot.test.autoconfigure.webservices.client.MockWebServiceServerTestExecutionListener@158a3b2e]
23:08:25.486 [main] DEBUG org.springframework.test.context.support.AbstractDirtiesContextTestExecutionListener - Before test class: context [DefaultTestContext@56303b57 testClass = SipCalculatorApplicationTests, testInstance = [null], testMethod = [null], testException = [null], mergedContextConfiguration = [WebMergedContextConfiguration@4b2a01d4 testClass = SipCalculatorApplicationTests, locations = '{}', classes = '{class com.sipCalculator.SipCalculatorApplication}', contextInitializerClasses = '[]', activeProfiles = '{}', propertySourceLocations = '{}', propertySourceProperties = '{org.springframework.boot.test.context.SpringBootTestContextBootstrapper=true}', contextCustomizers = set[org.springframework.boot.test.context.filter.ExcludeFilterContextCustomizer@730d2164, org.springframework.boot.test.json.DuplicateJsonObjectContextCustomizerFactory$DuplicateJsonObjectContextCustomizer@4ee203eb, org.springframework.boot.test.mock.mockito.MockitoContextCustomizer@0, org.springframework.boot.test.web.client.TestRestTemplateContextCustomizer@3214ee6, org.springframework.boot.test.autoconfigure.actuate.metrics.MetricsExportContextCustomizerFactory$DisableMetricExportContextCustomizer@a8ef162, org.springframework.boot.test.autoconfigure.properties.PropertyMappingContextCustomizer@0, org.springframework.boot.test.autoconfigure.web.servlet.WebDriverContextCustomizerFactory$Customizer@1cf56a1c, org.springframework.boot.test.context.SpringBootTestArgs@1, org.springframework.boot.test.context.SpringBootTestWebEnvironment@11a9e7c8], resourceBasePath = 'src/main/webapp', contextLoader = 'org.springframework.boot.test.context.SpringBootContextLoader', parent = [null]], attributes = map['org.springframework.test.context.web.ServletTestExecutionListener.activateListener' -> true]], class annotated with @DirtiesContext [false] with mode [null].

  .   ____          _            __ _ _
 /\\ / ___'_ __ _ _(_)_ __  __ _ \ \ \ \
( ( )\___ | '_ | '_| | '_ \/ _` | \ \ \ \
 \\/  ___)| |_)| | | | | || (_| |  ) ) ) )
  '  |____| .__|_| |_|_| |_\__, | / / / /
 =========|_|==============|___/=/_/_/_/
 :: Spring Boot ::                (v2.7.3)

2024-08-25 23:08:25.630  INFO 18136 --- [           main] c.s.SipCalculatorApplicationTests        : Starting SipCalculatorApplicationTests using Java 17.0.10 on Sandhyas-MacBook-Air.local with PID 18136 (started by sandhyas in /Users/sandhyas/.jenkins/workspace/Calculator)
2024-08-25 23:08:25.631  INFO 18136 --- [           main] c.s.SipCalculatorApplicationTests        : No active profile set, falling back to 1 default profile: "default"
2024-08-25 23:08:26.269  INFO 18136 --- [           main] c.s.SipCalculatorApplicationTests        : Started SipCalculatorApplicationTests in 0.756 seconds (JVM running for 1.201)
[INFO] Tests run: 1, Failures: 0, Errors: 0, Skipped: 0, Time elapsed: 1.073 s - in com.sipCalculator.SipCalculatorApplicationTests
[INFO] Running com.sipCalculator.controller.SIPControllerTest
[ERROR] Tests run: 2, Failures: 1, Errors: 0, Skipped: 0, Time elapsed: 0 s <<< FAILURE! - in com.sipCalculator.controller.SIPControllerTest
[ERROR] testReturnResult  Time elapsed: 0 s  <<< FAILURE!
org.opentest4j.AssertionFailedError: expected: <82486> but was: <824864>
	at com.sipCalculator.controller.SIPControllerTest.testReturnResult(SIPControllerTest.java:39)

[INFO] 
[INFO] Results:
[INFO] 
[ERROR] Failures: 
[ERROR]   SIPControllerTest.testReturnResult:39 expected: <82486> but was: <824864>
[INFO] 
[ERROR] Tests run: 3, Failures: 1, Errors: 0, Skipped: 0
[INFO] 
[INFO] ------------------------------------------------------------------------
[INFO] BUILD FAILURE
[INFO] ------------------------------------------------------------------------
[INFO] Total time:  3.684 s
[INFO] Finished at: 2024-08-25T23:08:27+05:30
[INFO] ------------------------------------------------------------------------
[ERROR] Failed to execute goal org.apache.maven.plugins:maven-surefire-plugin:2.22.2:test (default-test) on project SIPCalculator: There are test failures.
[ERROR] 
[ERROR] Please refer to /Users/sandhyas/.jenkins/workspace/Calculator/target/surefire-reports for the individual test results.
[ERROR] Please refer to dump files (if any exist) [date].dump, [date]-jvmRun[N].dump and [date].dumpstream.
[ERROR] -> [Help 1]
[ERROR] 
[ERROR] To see the full stack trace of the errors, re-run Maven with the -e switch.
[ERROR] Re-run Maven using the -X switch to enable full debug logging.
[ERROR] 
[ERROR] For more information about the errors and possible solutions, please read the following articles:
[ERROR] [Help 1] http://cwiki.apache.org/confluence/display/MAVEN/MojoFailureException
[Pipeline] }
[Pipeline] // withEnv
[Pipeline] }
[Pipeline] // stage
[Pipeline] stage
[Pipeline] { (Sonar-Analytics)
Stage "Sonar-Analytics" skipped due to earlier failure(s)
[Pipeline] getContext
[Pipeline] }
[Pipeline] // stage
[Pipeline] stage
[Pipeline] { (Docker Build & Tag)
Stage "Docker Build & Tag" skipped due to earlier failure(s)
[Pipeline] getContext
[Pipeline] }
[Pipeline] // stage
[Pipeline] stage
[Pipeline] { (Trivy Image Scan)
Stage "Trivy Image Scan" skipped due to earlier failure(s)
[Pipeline] getContext
[Pipeline] }
[Pipeline] // stage
[Pipeline] stage
[Pipeline] { (Docker Push Image)
Stage "Docker Push Image" skipped due to earlier failure(s)
[Pipeline] getContext
[Pipeline] }
[Pipeline] // stage
[Pipeline] stage
[Pipeline] { (Deploy)
Stage "Deploy" skipped due to earlier failure(s)
[Pipeline] getContext
[Pipeline] }
[Pipeline] // stage
[Pipeline] }
[Pipeline] // withEnv
[Pipeline] }
[Pipeline] // withEnv
[Pipeline] }
[Pipeline] // node
[Pipeline] End of Pipeline
ERROR: script returned exit code 1
Finished: FAILURE